{
  "schema_version": "2.0.0",
  "grade_profile_id": "instagram_white_diffuse_closeup_grade_v3",
  "input_color_space": "sRGB",
  "output_color_space": "sRGB",
  "transform": {
    "exposure_ev": 0.03,
    "contrast": 1.03,
    "saturation": 0.95,
    "warmth": 0.04,
    "shadow_lift": 0.018,
    "highlight_rolloff": 0.4
  },
  "strength": {
    "default": 0.32,
    "min": 0.0,
    "max": 0.58
  },
  "protection": {
    "regions": ["product", "logo", "skin"],
    "mask_strength": 0.9
  },
  "targeted_relight": {
    "policy_id": "bright_low_chroma_relight_v2",
    "scope": "protection_mask",
    "luma_range": [0.74, 0.98],
    "max_saturation": 0.18,
    "luma_feather": 0.11,
    "saturation_feather": 0.05,
    "exposure_ev": -0.14,
    "saturation": 0.9,
    "warmth": 0.035,
    "reflected_tint_rgb": [0.9, 0.9, 0.84],
    "reflected_tint_strength": 0.07,
    "blend_strength": 0.54,
    "spatial_focus": {
      "center": [0.5, 0.45],
      "radius": [0.42, 0.54],
      "feather": 0.18
    }
  },
  "qa_limits": {
    "max_dark_clip_ratio": 0.01,
    "max_bright_clip_ratio": 0.015
  }
}
