{
  "grade_profile_id": "instagram_wood_45deg_relational_v3_grade_v1",
  "input_color_space": "sRGB",
  "local_contrast": {
    "amount": 0.1,
    "radius": 2.4,
    "threshold": 7
  },
  "output_color_space": "sRGB",
  "protection": {
    "mask_strength": 0.94,
    "regions": [
      "product",
      "logo",
      "skin"
    ]
  },
  "qa_limits": {
    "max_bright_clip_ratio": 0.008,
    "max_dark_clip_ratio": 0.006
  },
  "schema_version": "2.0.0",
  "selective_saturation": {
    "blue": 0.94,
    "cyan": 0.96,
    "green": 0.97,
    "magenta": 0.95,
    "red": 0.95,
    "yellow": 0.86
  },
  "split_tone": {
    "balance": 0.56,
    "highlight_rgb": [
      0.82,
      0.79,
      0.72
    ],
    "shadow_rgb": [
      0.24,
      0.23,
      0.22
    ],
    "strength": 0.018
  },
  "strength": {
    "default": 0.34,
    "max": 0.52,
    "min": 0.0
  },
  "tone_curve": [
    [
      0.0,
      0.012
    ],
    [
      0.06,
      0.052
    ],
    [
      0.2,
      0.178
    ],
    [
      0.5,
      0.49
    ],
    [
      0.76,
      0.765
    ],
    [
      0.93,
      0.91
    ],
    [
      1.0,
      0.963
    ]
  ],
  "transform": {
    "contrast": 1.035,
    "exposure_ev": -0.04,
    "highlight_rolloff": 0.54,
    "saturation": 0.9,
    "shadow_lift": 0.002,
    "warmth": 0.012
  }
}
